urdu,english
مثال کے طور پر زید نے احمد کو آج ایک لاکھ روپے دیے اور احمد نے دوچار سال کے بعد کسی اضافے کے بغیر اصل رقم واپس کر دی تو اس کا مطلب یہ ہو گا کہ اس نے زید کو باعتبار مالیت ایک لاکھ کے بجائے پچاسی ہزار ہی واپس کیے۔,"For example, Zaid gave Ahmed one lakh rupees today and Ahmed returned the original money without any increase after two years, so it would mean that he returned Zaid to fifty thousand instead of one lakh."
پہلے خطاب میں نواز شریف نے جوڈیشل کمیشن کا اعلان کیا جس کو اپوزیشن نے مسترد کر دیا اور اس کو ذاتی خطاب قرار د یا ۔,"In the first address, Nawaz Sharif announced the Judicial Commission, which was rejected by the opposition and declared it a personal address."
دوسری جانب بشارالاسد کے خلاف جنگ کا بہانہ لے کر ایران، عراق اور شام کو روس کی چھتری کے نیچے کھڑا کر دیا گیا۔,"On the other hand, Iran, Iraq and Syria were erected under the umbrella of Russia, with an excuse for the war against Bashar al -Assad."
"ہر جگہ لڑکیوں سے کہا جاتا ہے کہ ""ابھی اپنی پسند کے کپڑے پہنو ، شادی کے بعد تو شوہر ہی کی پسند کے کپڑے پہننے ہیں""۔","Everywhere girls are told, ""Wear your choice now, after marriage, the husband has to wear clothes of choice""."
"روسی انقلاب کے بانی ولادی میر لینن نے اپنی جدوجہد میں اسی نقطے کی تفہیم ان الفاظ میں کی تھی ""جنگ بذات خود کوئی مقصد نہیں ہوتی، بلکہ یہ سیاست کا ایک آلہ ہوتی ہے۔","In his struggle, Vladimir Lenin, the founder of the Russian Revolution, understood the same point in the words ""War itself is not aimed at itself, but it is a tool of politics."""
جرمن چانسلر انگیلا میرکل اور بھارتی وزیر اعظم نریندر مودی نے توانائی کے شعبے کے علاوہ جرمنی کی بھارت میں سرمایا کاری کی رفتار تیز کرنے سے متعلق متعدد سمجھوتوں پر دستخط کر دیے ہیں۔,"German Chancellor Angela Merkel and Indian Prime Minister Narendra Modi have signed several agreements on the energy sector, as well as Germany's acceleration of investment in India."
سابق سویت یونین کے خلاف جنگ میں ملا اختر منصور نے بھی حصہ لیا تھا اور 90 کی دہائی کے آخر میں جب افغانستان میں ملا عمر کی سربراہی میں تحریک طالبان بنائی گئی تو ملا اختر محمد منصوراُس میں شامل ہوئے۔,"Mullah Akhtar Mansoor also participated in the war against the former Soviet Union, and Mullah Akhtar Mohammad joined Mansoor in the late 90s when Mullah Omar was led by Mullah Omar."
مولوی عبد الحق کے مضمون کے اختتام پر ظفر علی خاں نے ”رحلت مصطفی کا مل پا شا“ نظم بھی لکھی ہے۔,"Zafar Ali Khan has also written the poem ""Rahmat Mustafa's meeting"" at the end of Maulvi Abdul Haq's article."
تمام محققین یہی مانتے ہیں۔,That's what all the researchers believe.
میں نے سوچا میں اِسے اگر اپنے کندھے پر لٹکا لوں تو لوگ مجھ سے خوف کھائیں گے ۔,"I thought I would hang him on my shoulder, people would be afraid of me."
ڈاکٹر فوزیہ صدیقی نے خواتین کے عالمی دن کے موقع پر بہت خوب کہا کہ : دنیا نے عافیہ کو یاد رکھا ، حکمرانوں نے نظر انداز کیا ، خواتین کے عالمی دن پر بھی حکومت مغرب کے پیروں کو چاٹتی رہی کس قدر افسوس اور قلق کی بات ہے کہ خواتین کے عالمی ڈے پر بھی حکومت نے قوم کی بیٹی کو فراموش کر دیا ۔,"Dr. Fauzia Siddiqui said very well on the occasion of World Women's Day: The world remembered Aafia, the rulers ignored, even on the International Women's Day, the government kept licking the feet of the West."
انہیں مفت تعلیم، صحت اور دیگر سہولتیں بھی مہیا کی جا رہی ہیں۔,"They are also being provided free education, health and other facilities."
یہ جلد کو جُھریوں سے بچاتی ہے اور جلد کو نرم وتازہ رکھتی ہے۔,It protects the skin from zodiacs and keeps the skin soft.
اور والدین کی احسان فراموشی تو گناہ کبیرہ کے زمرے میں آتی ہے۔,And the kindness of the parents falls into the category of sin.
اس مقصد کے حصول کے لیے سب سے موثر طریقہ روزہ ہے۔,Fasting is the most effective way to achieve this goal.
یوں یہ ایسا ڈھونگ اور ڈرامہ بن گیا ہے جس کے ذریعے بے پناہ دولت رکھنے والا امیدوار ہی جیت سکتا ہے۔,Thus it has become a drama and a drama through which only a candidate with a wealthy wealth can win.
بات تلخ ہے، لیکن حقیقت یہ ہے کہ مسلمانوں کے مختلف فرقوں، مسلکوں، مشربوں اورجماعتوں نے ایک دوسرے کے خلاف تکفیر و تفسیق کابے محابااوربے مہاراستعمال کیا ہے اور آج بھی اس میں کوئی کمی بعض اہل افتااوراہل مدارس کی روش کو دیکھتے ہوئے کہناپڑرہاہے کہ نہیں آ رہی ہے۔,"The thing is bitter, but the fact is that different sects, cults, polytheists and congregations of Muslims have used the takfir and unprecedented masterpiece against each other, and even today, there is no shortage of it, looking at the attitude of some elite and the madrassas."
وہ سوچتے ہیں کہ کیاواقعی مقررہ مدت تک انتخابات ہو جائیں گے؟,They think that elections will be held for a long period of time?
یہ وہ ترازو ہے جس پر ہر چیز کو تولا جانا ہے۔,This is the scales on which everything has to be weighed.
جی ہاں وہ زلزلہ ہی تھا۔,Yes it was an earthquake.
اللہ بڑی قدرت والا ہے، اور اللہ غفور و رحیم ہے۔,"Allah is All -power, and Allah is Forgiveness and Mercy."
انسان چونکہ اِس دنیا میں اپنا ایک عملی وجود بھی رکھتا ہے، اِس لیے اللہ تعالیٰ کے لیے اُس کا جذبۂ عبادت جب اُس کے عملی وجود سے متعلق ہوتا ہے تو پرستش کے ساتھ اطاعت کو بھی شامل ہو جاتا ہے۔,"Since man also has his own practical existence in this world, his passion for Almighty, when he is related to his practical existence, also involves obedience with worship."
پولیس کا کہنا ہے کہ پریس کلب کا گھیراؤ کرنے والے مظاہرین کی شناخت کے بعد انسداد دہشت گردی ایکٹ کے تحت مقدمہ درج کیا جائے گا۔,Police say a case will be registered under the Anti -Terrorism Act after the press club's protesters were identified.
خاص طور پر جامعات میں تحقیقی مقالات لکھنے کے لیے طلبہ کی اکثریت فکشن کو اپنا موضوع بنانے کی خواہش مند نظر آتی ہے۔,"The majority of students, especially in the universities, look forward to making fiction their subject."
یہ لوگ تم میں سے اچھے لوگ نہیں۔,These people are not good people.
گذشتہ دو ہفتوں کے دوران حلب میں شدید ہونے والی لڑائی میں 300 سو کے قریب لوگ مارے جا چکے ہیں۔,About 300 people have been killed in a severe fighting in Aleppo over the past two weeks.
خیر یہی واقعہ اکڑ دکھانے والا خواجہ سعد رفیق اور احسن اقبال پر بھی فٹ ہو سکتا ہے۔,"Well, the same incident can be fitted on Khawaja Saad Rafiq and Ahsan Iqbal."
انھیں کے حساب سے ٹالسٹائی کے ناول War and Peace کے اردو مترجم شاہد حمید صاحب، اگرچہ بڑے محنتی ہیں، صحتِ لفظی کا کچھ زیادہ ہی خیال رکھتے ہیں۔,"According to him, Shahid Hameed Sahib, the Urdu translator of Tolstoy's novel War and Peace, has a lot of care for the literal health."
آج کے میچ میں بلال آصف کو عمدہ آل رائونڈر کارکردگی پر مین آف دی میچ قراردیاگیا ،جنہوں نے 5 وکٹیں لینے کے ساتھ اسکور میں 38 رنز کا اضافہ بھی کیا ۔,"In today's match, Bilal Asif was declared Man of the Match on the excellent all -rounder performance, who took 5 wickets and added 38 runs."
بلاول بھٹوکوپیپلزپارٹی پر کرپشن کے الزامات سے جان چھوڑانا ہوگی اور عوام کو یہ بات باور کرانی ہوگی کہ اسے کرپشن سے نفرت ہے اور عوامی فلاح کے منصوبوں کے ذریعے محروم طبقات کا معیار زندگی بلند کرنا اس کیاولین ترجیح ہے۔,The Bilawal Bhuttopopi PPP will have to quit the allegations of corruption and the public will have to believe that it hates corruption and that it is a priority to raise the standard of living of the deprived sections through public welfare schemes.
اللہ ہی نے پیدا کیا ہے تم کو بھی اور ان چیزوں کو بھی جن کو تم بناتے ہو۔,Allah has created you and the things you make.
یہ پیپرانسانی زندگی کے نشووارتقا سے براہ راست بحث نہیں کرتا، اورآدم کا تذکرہ بھی اس میں ثانوی حیثیت میں آیا ہے۔,"This paper does not directly discuss the development of life, and the mention of Adam is also mentioned in it."
اس طرح میں نہ ان سے اور نہ چچا محمود صاحب سے زیادہ استفادہ کر سکا۔,In this way I could neither benefit from them nor Uncle Mahmood.
کیا پاکستان میں قدرتی آفات سے نمٹنےکا ادارہ اور مطلوبہ وسائلٴ موجود نہیں ؟,Does Pakistan not have natural disasters and resources to deal with natural disasters?
یہ الگ بحث ہے کہ انھوں نے حملہ غلط کیا ہے یا صحیح، لیکن اسے آپ دہشت گردی نہیں کہہ سکتے۔,"It is a separate debate whether they have done wrong or right, but you cannot call it terrorism."
دعا ایک ایسا عمل ہے جس کی ضرورت ہم سب کو ہوتی ہے ۔,Prayer is a process that we all need.
اس وقت سے لے کر وفات تک ان کے ۳۲ ناول اور ۱۳ افسانوں کے مجموعے شائع ہوئے، وہ انسانی نفسیات کو خوب سمجھتے تھے اور اپنے افسانوں اور ناولوں کے ہیروز کا نقشہ اس خوب صورتی سے کھینچتے تھے کہ افسانے پر حقیقت کا گمان گزرتا تھا۔,"From that time to his death, his collections of three novels and 3 legends were published, he understood human psychology well, and the map of the heroes of his legends and novels was pulling so well that the fiction used to be a reality."
اس دور میں جن حضرات نے ان سے روایات لی ہیں، ان کی روایات میں بظاہر اس تصور کی گنجایش موجود ہے کہ ان میں ارسال ہو، مگر حقیقت اس کے برعکس ہے۔,"The traditions of the gentlemen who have taken traditions from them in this period apparently have the potential to be sent to them, but the truth is the opposite."
انہوں نے طلاق اور ریحام خان کے معاملے پر بھارتی صحافیوں کو لاجواب کر دیا۔,He made Indian journalists terrific on the issue of divorce and Reham Khan.
بچے انہیں آتے جاتے چھیڑنے کی کوشش کرتے ہیں ۔,Children try to tease them.
انتہا پسند ہندؤوں کی طرف سے مسلمانوں کو شدید تنقید کا نشانہ بنانے اورتشدد کرنے کے واقعات میں حیرت انگیز اضافے کے بعد ان کی اہلیہ کرن راؤ جو کہ ہندو مذہب سے تعلق رکھتی ہیں لیکن انھوں نے اپنے شوہر کوہندوستان چھوڑنے کا مشورہ دیا ہے، جس سے اندازہ لگایا جا سکتا ہے کہ وہاں پرحالات کس قدرخراب ہیں، ایسے میں بطورپاکستانی میں نے انھیں لاہورآنے کی دعوت دی ہے۔,"After a surprising increase in the incidents of extremist Hindus and violence against Muslims, his wife, Kiran Rao, who belongs to Hindu religion, has advised her husband to leave India, which can be gauged from how much she is in a state of affairs."
جس چیز سے منع کیا گیا ہے، وہ یہ ہے کہ آپ کی اچانک نگاہ پڑ گئی تو اس کے بعد مقام حسن پر آپ نے دوبارہ نظر دوڑائی اورگھورتے ہی چلے گئے۔,"What is forbidden is that if you suddenly looked, then after that you looked back at the place of beauty and went away."
جواب ملتا ہے۔,The answer is
محکمہ جنگلات کے حکام نے دی کپتان کو بریفنگ ۔,Forest department officials briefed the captain.
میں مسکرایا۔,I smiled.
یہ موقف تھا ائیر انڈیا کے اُس پائلٹ کا جو تاخیر سے آنے والے کیرالہ کے گورنر کو چھوڑکر ہی طیارہ لے اڑا ۔,It was the position of the Air India pilot who left the plane at the delayed Kerala governor.
غامدی صاحب لکھتے ہیں: ”...اِس میں عدالت کو مخاطب کر کے یہ بات نہیں کہی گئی کہ اِس طرح کا کوئی مقدمہ اگر پیش کیا جائے تو مدعی سے اِس نصاب کے مطابق گواہ طلب کرو۔,"Ghamdi writes: ""... It is not addressed by the court and it was not said that if any such case is presented, ask the plaintiff according to the curriculum."
“ وَاِنْ یَّسْتَغِیْثُوْا یُغَاثُوْا بِمَآءٍ کَالْمُھْلِ یَشْوِی الْوُجُوْہَ، بِءْسَ الشَّرَابُ، وَسَآءَ تْ مُرْتَفَقًا. (الکہف ۱۸: ۲۹) ”اگر وہ پانی کے لیے فریاد کریں گے توان کی فریاد رسی اس پانی سے کی جائے گی جو پگھلے ہوئے تانبے کی طرح ہو گا۔,"“ وَاِنْ یَّسْتَغِیْثُوْا یُغَاثُوْا بِمَآءٍ کَالْمُھْلِ یَشْوِی الْوُجُوْہَ، بِءْسَ الشَّرَابُ، وَسَآءَ تْ مُرْتَفَقًا. (الکہف ۱۸: ۲۹) ”اگر وہ پانیFor the sake of crying, the rope of energy will be made with the water that will be like a molten copper."
حج پالیسی 2016 کا اعلان کر دیا گیا۔,Hajj Policy 2016 was announced.
حلال و حرام کے معاملے میں یہ خدا کا اعلان ہے، لہٰذا کسی کو بھی حق نہیں پہنچتا کہ وہ اِن کے علاوہ کسی چیز کو حرام ٹھیرائے۔,"In the case of halal and haraam, it is the declaration of God, so no one has the right to make anything other than them."
کملا ایک نرتکی ہے جو اسے سکھاتی ہے کہ اختلاط کا فن کیا ہوتا ہے اور عورت کی مہربانی میں کیسے رموز پنہاں ہوتے ہیں۔,Kamala is a Nartki who teaches her what the art of mixing is and how the women are in the kindness of the woman.
کعب بن اشرف دفعہ 6 کا مجرم تھا ، عہد کر کے ریاست کے دشمنوں سےملا ھوا تھا ، انہیں چڑھا لانے ، اور مسلمانوں پر اندر سے وار کرنے کا معاہدہ کیا تھا اس نے ، اس کا قتل غداری کی سزا تھی نیز مسلمان مستورات کے بارے میں شاعری کر کے وہ سورہ الاحزاب کی آیت قتلوا تقتیلا کا شکار بنا تھا ، لئن لم ينته المنافقون والذين في قلوبهم مرض والمرجفون في المدينة لنغرينك بهم ثم لا يجاورونك فيها إلا قليلا ( الاحزاب- 60 ) ملعونين أينما ثقفوا أخذوا وقتلوا تقتيلا ( 61 )جن جن کے بارے میں قرآن نے گواھی دی ھے کہ انہوں نے نبیﷺ کی توھین کی ،، ان میں سے کتنے لوگوں کو قتل کیا گیا ؟,"Ka'b ibn Ashraf was the culprit of Article 6, the covenant was met with the enemies of the state, he signed a treaty to climb, and to attack the Muslims.Lagarnak Baham Tam La Yajawar and Fiha-e-Qalalla (Al-Hijab-60) Malniyan-e-Amina-e-Saqfawa-e-Khazawa Taqat-e-Takhtila (61) about whom the Qur'an has testified that he inspired the Prophet, how many of them were killed?"
